{
  "incident_id": "incident-example",
  "run_id": "11111111-1111-4111-8111-111111111111",
  "feedback_ids": [
    "22222222-2222-4222-8222-222222222222"
  ],
  "confirmed_cause": "oom_killed",
  "incident_outcome": "resolved",
  "predicted_categories": [
    "oom_killed"
  ],
  "status": "match",
  "prediction_kind": "fixture",
  "provider": "fake",
  "model_name": "fixture-v1"
}
